{
	"build_slots": [
		{
			"entity_id": 30,
			"team_id": 1,
			"whitelist": [
				1,
				2,
				3
			],
			"x": -131072,
			"y": 0,
			"z": -262144
		},
		{
			"entity_id": 31,
			"team_id": 1,
			"whitelist": [
				1,
				2,
				3
			],
			"x": -131072,
			"y": 0,
			"z": -393216
		},
		{
			"entity_id": 32,
			"team_id": 1,
			"whitelist": [
				1,
				2,
				3
			],
			"x": -131072,
			"y": 0,
			"z": -524288
		},
		{
			"entity_id": 33,
			"team_id": 2,
			"whitelist": [
				1,
				2,
				3
			],
			"x": -131072,
			"y": 0,
			"z": 262144
		},
		{
			"entity_id": 34,
			"team_id": 2,
			"whitelist": [
				1,
				2,
				3
			],
			"x": -131072,
			"y": 0,
			"z": 393216
		},
		{
			"entity_id": 35,
			"team_id": 2,
			"whitelist": [
				1,
				2,
				3
			],
			"x": -131072,
			"y": 0,
			"z": 524288
		}
	],
	"cell": 65536,
	"cores": [
		{
			"entity_id": 10,
			"max_health": 20,
			"node_id": 1,
			"team_id": 1
		},
		{
			"entity_id": 11,
			"max_health": 20,
			"node_id": 11,
			"team_id": 2
		}
	],
	"economy": {
		"base_income": 60,
		"bounty_cap": 120,
		"initial_gold": 200,
		"obstacle_points": 6,
		"prep_ticks": 1200,
		"setup_ticks": 1800,
		"time_limit_ticks": 18000,
		"wave_interval_ticks": 900
	},
	"edges": [
		{
			"cost": 2,
			"from_id": 2,
			"to_id": 1
		},
		{
			"cost": 2,
			"from_id": 3,
			"to_id": 2
		},
		{
			"cost": 2,
			"from_id": 3,
			"to_id": 7
		},
		{
			"cost": 2,
			"from_id": 4,
			"to_id": 3
		},
		{
			"cost": 2,
			"from_id": 5,
			"to_id": 1
		},
		{
			"cost": 2,
			"from_id": 6,
			"to_id": 5
		},
		{
			"cost": 2,
			"from_id": 7,
			"to_id": 6
		},
		{
			"cost": 2,
			"from_id": 8,
			"to_id": 9
		},
		{
			"cost": 2,
			"from_id": 9,
			"to_id": 10
		},
		{
			"cost": 2,
			"from_id": 9,
			"to_id": 12
		},
		{
			"cost": 2,
			"from_id": 10,
			"to_id": 11
		},
		{
			"cost": 2,
			"from_id": 12,
			"to_id": 13
		},
		{
			"cost": 2,
			"from_id": 13,
			"to_id": 14
		},
		{
			"cost": 2,
			"from_id": 14,
			"to_id": 11
		}
	],
	"gameplay": "bastion",
	"obstacle_slots": [
		{
			"entity_id": 40,
			"node_id": 3,
			"team_id": 1,
			"whitelist": [
				21,
				22,
				23
			]
		},
		{
			"entity_id": 41,
			"node_id": 2,
			"team_id": 1,
			"whitelist": [
				21,
				22
			]
		},
		{
			"entity_id": 42,
			"node_id": 7,
			"team_id": 1,
			"whitelist": [
				21,
				22
			]
		},
		{
			"entity_id": 43,
			"node_id": 9,
			"team_id": 2,
			"whitelist": [
				21,
				22,
				23
			]
		},
		{
			"entity_id": 44,
			"node_id": 10,
			"team_id": 2,
			"whitelist": [
				21,
				22
			]
		},
		{
			"entity_id": 45,
			"node_id": 12,
			"team_id": 2,
			"whitelist": [
				21,
				22
			]
		}
	],
	"schema_version": 1,
	"source_revision": 1,
	"spawns": [
		{
			"entity_id": 20,
			"node_id": 4,
			"team_id": 1
		},
		{
			"entity_id": 21,
			"node_id": 8,
			"team_id": 2
		}
	],
	"waves": [
		{
			"count": 6,
			"index": 1,
			"interval_ticks": 30,
			"prototype_id": 11
		},
		{
			"count": 10,
			"index": 2,
			"interval_ticks": 15,
			"prototype_id": 13
		},
		{
			"count": 4,
			"index": 3,
			"interval_ticks": 45,
			"prototype_id": 12
		}
	],
	"waypoints": [
		{
			"node_id": 1,
			"team_id": 1,
			"x": 0,
			"y": 0,
			"z": -524288
		},
		{
			"node_id": 2,
			"team_id": 1,
			"x": 0,
			"y": 0,
			"z": -393216
		},
		{
			"node_id": 3,
			"team_id": 1,
			"x": 0,
			"y": 0,
			"z": -262144
		},
		{
			"node_id": 4,
			"team_id": 1,
			"x": 0,
			"y": 0,
			"z": -131072
		},
		{
			"node_id": 5,
			"team_id": 1,
			"x": 131072,
			"y": 0,
			"z": -524288
		},
		{
			"node_id": 6,
			"team_id": 1,
			"x": 131072,
			"y": 0,
			"z": -393216
		},
		{
			"node_id": 7,
			"team_id": 1,
			"x": 131072,
			"y": 0,
			"z": -262144
		},
		{
			"node_id": 8,
			"team_id": 2,
			"x": 0,
			"y": 0,
			"z": 131072
		},
		{
			"node_id": 9,
			"team_id": 2,
			"x": 0,
			"y": 0,
			"z": 262144
		},
		{
			"node_id": 10,
			"team_id": 2,
			"x": 0,
			"y": 0,
			"z": 393216
		},
		{
			"node_id": 11,
			"team_id": 2,
			"x": 0,
			"y": 0,
			"z": 524288
		},
		{
			"node_id": 12,
			"team_id": 2,
			"x": 131072,
			"y": 0,
			"z": 262144
		},
		{
			"node_id": 13,
			"team_id": 2,
			"x": 131072,
			"y": 0,
			"z": 393216
		},
		{
			"node_id": 14,
			"team_id": 2,
			"x": 131072,
			"y": 0,
			"z": 524288
		}
	]
}
